name;city;start_day;start_month;start_year;end_day;end_month;end_year;link
UK Language Variation and Change 12;London;03;8;2019;05;8;2019;https://linguistlist.org/callconf/browse-conf-action.cfm?ConfID=353816
XXXVI. Romanistentag 2019 – Sektion 16: Rekonstruktion und Erneuerung romanischer Regional- oder Minderheitensprachen im Zeitalter der Digital Humanities;Kassel;29;8;2019;02;9;2019;https://linguistlist.org/callconf/browse-conf-action.cfm?ConfID=353856
21st Inuit Studies Conference;Montreal, Quebec;03;9;2019;06;9;2019;https://linguistlist.org/callconf/browse-conf-action.cfm?ConfID=352236
35th South Asian Language Analysis Roundtable;Paris;29;9;2019;31;9;2019;https://linguistlist.org/callconf/browse-conf-action.cfm?ConfID=350236
4th English for Healthcare Conference;Universitat Jaume I, Castello de la Plana, Spain;03;9;2019;04;9;2019;https://linguistlist.org/callconf/browse-conf-action.cfm?ConfID=352136
4th Workshop on Sound Change;Salamanca;18;9;2019;18;9;2019;https://linguistlist.org/callconf/browse-conf-action.cfm?ConfID=331556
5th Saarbrücken Conference on Foreign Language Teaching;Saarbrücken;29;9;2019;31;9;2019;https://linguistlist.org/callconf/browse-conf-action.cfm?ConfID=337036
6th ICLHE Conference: Multilingualism and Multimodality in Higher Education;Castellón;15;9;2019;18;9;2019;https://linguistlist.org/callconf/browse-conf-action.cfm?ConfID=354676
Catégorisation claire vs approximative : à la recherche d’indices de différenciation;Strasbourg;03;9;2019;04;9;2019;https://linguistlist.org/callconf/browse-conf-action.cfm?ConfID=350276
Clear vs Approximate Categorization: Searching for Signs of Differentiation;Strasbourg;03;9;2019;04;9;2019;https://linguistlist.org/callconf/browse-conf-action.cfm?ConfID=354016
Colloque de Syntaxe et Sémantique à Paris;Paris;02;9;2019;04;9;2019;https://linguistlist.org/callconf/browse-conf-action.cfm?ConfID=356716
ICODOC 2019: Emotion, Empathy, Affectivity. Subjects and their Subjectivity through Linguistic and Educative Practices;Lyon;07;9;2019;09;9;2019;https://linguistlist.org/callconf/browse-conf-action.cfm?ConfID=355496
I Encuentro Latinoamericano de Interfaces Gramaticales;Mendoza;10;9;2019;12;9;2019;https://linguistlist.org/callconf/browse-conf-action.cfm?ConfID=356056
International Conference on Verbal Humor;University of Alicante (San Vicente del Raspeig);23;9;2019;25;9;2019;https://linguistlist.org/callconf/browse-conf-action.cfm?ConfID=349736
Les idéologies linguistiques dans la presse écrite : l’exemple des langues romanes;Messina;23;9;2019;25;9;2019;https://linguistlist.org/callconf/browse-conf-action.cfm?ConfID=344876
Lexicon and Genre Boundaries;Bayonne, Basque Country;10;9;2019;12;9;2019;https://linguistlist.org/callconf/browse-conf-action.cfm?ConfID=345897
Metadiscourse across Languages and Contexts;Chang Chun, Jilin;18;9;2019;20;9;2019;https://linguistlist.org/callconf/browse-conf-action.cfm?ConfID=352256
2nd International Colloquium on Plurilingualism;Udine;14;10;2019;15;10;2019;https://linguistlist.org/callconf/browse-conf-action.cfm?ConfID=327376
A Psycholinguistic Approach to Construction Figures;Paris;22;10;2019;22;10;2019;https://linguistlist.org/callconf/browse-conf-action.cfm?ConfID=355616
Bayerisch-österreichische Dialektologentagung;Salzburg;07;10;2019;09;10;2019;https://linguistlist.org/callconf/browse-conf-action.cfm?ConfID=341976
Conference on Mediterranean Linguistic Anthropology;To Be Advised;27;10;2019;30;10;2019;https://linguistlist.org/callconf/browse-conf-action.cfm?ConfID=341537
Contemporary Approaches to Legal Linguistics - 1st international conference of the Austrian Association for Legal Linguistics;Vienna;08;10;2019;10;10;2019;https://linguistlist.org/callconf/browse-conf-action.cfm?ConfID=345736
Metalinguistic Discourses 3;University Paris 13;07;10;2019;08;10;2019;https://linguistlist.org/callconf/browse-conf-action.cfm?ConfID=356157
Tense, Aspect and Modality in L2, Huelva 2019;Huelva;21;10;2019;22;10;2019;https://linguistlist.org/callconf/browse-conf-action.cfm?ConfID=355357
7th New Zealand Discourse Conference;Wellington;03;11;2019;06;11;2019;https://linguistlist.org/callconf/browse-conf-action.cfm?ConfID=328256
Conference on Asian Linguistic Anthropology 2020;Bintulu, Sarawak;05;1;2020;08;1;2020;https://linguistlist.org/callconf/browse-conf-action.cfm?ConfID=355856
Myth-making and Myth-busting in and about Late Modern English;Ragusa;07;4;2020;09;4;2020;https://linguistlist.org/callconf/browse-conf-action.cfm?ConfID=335996
International Conference on English Historical Linguistics - 21;Leiden;08;5;2020;12;5;2020;https://linguistlist.org/callconf/browse-conf-action.cfm?ConfID=349896
Kontrastive Pragmatik;Palermo;26;6;2020;02;7;2020;https://linguistlist.org/callconf/browse-conf-action.cfm?ConfID=315976
XIV. Kongress der Internationalen Vereinigung für Germanistik;Palermo;26;6;2020;02;7;2020;https://linguistlist.org/callconf/browse-conf-action.cfm?ConfID=316856
Methods in Dialectology XVII;JGU Mainz;03;7;2020;07;7;2020;https://linguistlist.org/callconf/browse-conf-action.cfm?ConfID=331776
6th Prescriptivism Conference;Vigo;24;8;2020;26;8;2020;https://linguistlist.org/callconf/browse-conf-action.cfm?ConfID=334176
